[
  {
    "entry_id": "3ae1994f-f03d-4ec2-ae59-e8b79e87d71a",
    "headword_english": "Adultery",
    "pos": [
      "noun"
    ],
    "headword_sesotho": [
      {
        "orthographic": "bofebe",
        "tone_marked": "",
        "ipa": "",
        "tone_pattern": ""
      }
    ],
    "syllables": [
      "bofebe"
    ],
    "morphology": {
      "root": "",
      "derivation": "Historical Entry (Casalis)",
      "noun_class": "unknown"
    },
    "senses": [
      {
        "sense_id": "sense_1",
        "definition_en": "bofebe",
        "sesotho_term": [
          "bofebe"
        ]
      }
    ],
    "thesaurus": {
      "synonyms_en": [],
      "antonyms_en": [],
      "synonyms_st": [],
      "antonyms_st": []
    }
  },
  {
    "entry_id": "30414924-c070-4d2f-a882-de9127de432c",
    "headword_english": "Adversity",
    "pos": [
      "noun"
    ],
    "headword_sesotho": [
      {
        "orthographic": "bomalibe",
        "tone_marked": "",
        "ipa": "",
        "tone_pattern": ""
      }
    ],
    "syllables": [
      "bomalibe"
    ],
    "morphology": {
      "root": "",
      "derivation": "Historical Entry (Casalis)",
      "noun_class": "unknown"
    },
    "senses": [
      {
        "sense_id": "sense_1",
        "definition_en": "bomalibe, bosoto",
        "sesotho_term": [
          "bomalibe",
          "bosoto"
        ]
      }
    ],
    "thesaurus": {
      "synonyms_en": [],
      "antonyms_en": [],
      "synonyms_st": [],
      "antonyms_st": []
    }
  },
  {
    "entry_id": "entry_483d8836210996e3",
    "headword_english": "Agility",
    "pos": [
      "noun"
    ],
    "headword_sesotho": [
      {
        "orthographic": "bobebe",
        "tone_marked": "",
        "ipa": "",
        "tone_pattern": ""
      },
      {
        "orthographic": "l",
        "tone_marked": "",
        "ipa": "",
        "tone_pattern": ""
      }
    ],
    "syllables": [
      "bobebe",
      "l"
    ],
    "morphology": {
      "root": "",
      "derivation": "Historical Entry",
      "noun_class": "unknown"
    },
    "senses": [
      {
        "sense_id": "entry_483d8836210996e3.sense_1",
        "definition_en": "bobebe, lebelo",
        "sesotho_term": [
          "bobebe"
        ]
      }
    ],
    "thesaurus": {
      "synonyms_en": [],
      "antonyms_en": [],
      "synonyms_st": [],
      "antonyms_st": []
    }
  },
  {
    "entry_id": "a90f6b59-35c1-4a5a-bdc0-695fd1b160bb",
    "headword_english": "Agriculture",
    "pos": [
      "noun"
    ],
    "headword_sesotho": [
      {
        "orthographic": "bolemi",
        "tone_marked": "",
        "ipa": "",
        "tone_pattern": ""
      },
      {
        "orthographic": "temo",
        "tone_marked": "",
        "ipa": "",
        "tone_pattern": ""
      }
    ],
    "syllables": [
      "bolemi",
      "temo"
    ],
    "morphology": {
      "root": "",
      "derivation": "Historical Entry (Casalis)",
      "noun_class": "unknown"
    },
    "senses": [
      {
        "sense_id": "sense_1",
        "definition_en": "bolemi, temo",
        "sesotho_term": [
          "bolemi",
          "temo"
        ]
      }
    ],
    "thesaurus": {
      "synonyms_en": [],
      "antonyms_en": [],
      "synonyms_st": [],
      "antonyms_st": []
    }
  },
  {
    "entry_id": "601f9b59-7bdb-4b64-98a8-6d276eb9cdd5",
    "headword_english": "Ailment",
    "pos": [
      "noun"
    ],
    "headword_sesotho": [
      {
        "orthographic": "bohloko",
        "tone_marked": "",
        "ipa": "",
        "tone_pattern": ""
      }
    ],
    "syllables": [
      "bohloko"
    ],
    "morphology": {
      "root": "",
      "derivation": "Historical Entry (Casalis)",
      "noun_class": "unknown"
    },
    "senses": [
      {
        "sense_id": "sense_1",
        "definition_en": "bohloko, boloetse, lefu, mafu",
        "sesotho_term": [
          "bohloko",
          "boloetse"
        ]
      }
    ],
    "thesaurus": {
      "synonyms_en": [],
      "antonyms_en": [],
      "synonyms_st": [],
      "antonyms_st": []
    }
  },
  {
    "entry_id": "st_G14_003",
    "headword_english": "Allies / Confederates",
    "pos": [
      "n."
    ],
    "headword_sesotho": [
      {
        "orthographic": "balekane",
        "tone_marked": "bālēkānē",
        "ipa": "",
        "tone_pattern": ""
      }
    ],
    "syllables": [
      "ba-le-ka-ne"
    ],
    "morphology": {
      "root": "lekane",
      "derivation": "From 'lekane' (partner/friend/ally).",
      "noun_class": "2"
    },
    "senses": [
      {
        "sense_id": "st_G14_003.sense_1",
        "definition_en": "People or groups united by a treaty or covenant.",
        "sesotho_term": [
          "balekane",
          "bo-mphato ba selekane"
        ]
      }
    ],
    "thesaurus": {},
    "related_words": []
  },
  {
    "entry_id": "1464fd33-894a-4410-9657-1d993ded706d",
    "headword_english": "Altitude",
    "pos": [
      "noun"
    ],
    "headword_sesotho": [
      {
        "orthographic": "bolelele",
        "tone_marked": "",
        "ipa": "",
        "tone_pattern": ""
      }
    ],
    "syllables": [
      "bolelele"
    ],
    "morphology": {
      "root": "",
      "derivation": "Historical Entry (Casalis)",
      "noun_class": "unknown"
    },
    "senses": [
      {
        "sense_id": "sense_1",
        "definition_en": "bolelele, bophahamo, boholo",
        "sesotho_term": [
          "bolelele",
          "bophahamo"
        ]
      }
    ],
    "thesaurus": {
      "synonyms_en": [],
      "antonyms_en": [],
      "synonyms_st": [],
      "antonyms_st": []
    }
  },
  {
    "entry_id": "entry_7305bcdc6173c93f",
    "headword_english": "Amongst",
    "pos": [
      "preposition"
    ],
    "headword_sesotho": [
      {
        "orthographic": "bar'a",
        "tone_marked": "",
        "ipa": "",
        "tone_pattern": ""
      },
      {
        "orthographic": "har'a",
        "tone_marked": "",
        "ipa": "",
        "tone_pattern": ""
      }
    ],
    "syllables": [
      "bar'a",
      "har'a"
    ],
    "morphology": {
      "root": "",
      "derivation": "Historical Entry",
      "noun_class": "unknown"
    },
    "senses": [
      {
        "sense_id": "entry_7305bcdc6173c93f.sense_1",
        "definition_en": "har'a, mahareng a",
        "sesotho_term": [
          "har'a"
        ]
      },
      {
        "sense_id": "entry_5cb03dbf53ccf588.sense_1",
        "definition_en": "har'a, mahareng a",
        "sesotho_term": [
          "bar'a"
        ]
      }
    ],
    "thesaurus": {
      "synonyms_en": [],
      "antonyms_en": [],
      "synonyms_st": [],
      "antonyms_st": []
    }
  },
  {
    "entry_id": "st_G46_EX_05",
    "headword_english": "Ancestors",
    "pos": [],
    "headword_sesotho": [
      {
        "orthographic": "baholo-holo",
        "tone_marked": "bāhōlō-hōlō",
        "ipa": "",
        "tone_pattern": ""
      }
    ],
    "syllables": [
      "baholo-holo"
    ],
    "morphology": {
      "root": "holo",
      "derivation": "Reduplicated form of 'great/elder' for emphasis on lineage",
      "noun_class": "2"
    },
    "senses": [
      {
        "sense_id": "fam_02",
        "definition_en": "Forefathers; people from whom one is descended, usually more remote than grandparents.",
        "sesotho_term": [
          "baholo-holo"
        ]
      }
    ],
    "thesaurus": {
      "synonyms_en": [],
      "antonyms_en": [],
      "synonyms_st": [],
      "antonyms_st": []
    }
  },
  {
    "entry_id": "st_G4_010",
    "headword_english": "Anger / Wrath",
    "pos": [
      "n."
    ],
    "headword_sesotho": [
      {
        "orthographic": "bohale",
        "tone_marked": "bōhālē",
        "ipa": "",
        "tone_pattern": ""
      }
    ],
    "syllables": [
      "bo-ha-le"
    ],
    "morphology": {
      "root": "bohale",
      "derivation": "",
      "noun_class": "14"
    },
    "senses": [
      {
        "sense_id": "st_G4_010.sense_1",
        "definition_en": "A strong feeling of annoyance, displeasure, or hostility.",
        "sesotho_term": [
          "bohale"
        ]
      }
    ],
    "thesaurus": {},
    "related_words": []
  },
  {
    "entry_id": "entry_9117a8217962918c",
    "headword_english": "Aristocracy",
    "pos": [
      "n."
    ],
    "headword_sesotho": [
      {
        "orthographic": "borena",
        "tone_marked": "",
        "ipa": "",
        "tone_pattern": ""
      }
    ],
    "syllables": [
      "bo-re-na"
    ],
    "morphology": {
      "root": "rena",
      "derivation": "nominal bo-",
      "noun_class": "14"
    },
    "senses": [
      {
        "sense_id": "entry_9117a8217962918c.sense_1",
        "definition_en": "the highest class in certain societies, especially those holding hereditary titles or offices",
        "sesotho_term": [
          "borena",
          "baholo",
          "ba lelapa la borena"
        ]
      }
    ],
    "thesaurus": {
      "synonyms_en": [
        "nobility",
        "elite",
        "upper class"
      ],
      "synonyms_st": [
        "bahlomphehi"
      ],
      "antonyms_en": [
        "proletariat",
        "commoners"
      ],
      "antonyms_st": [
        "bafo",
        "setjhaba"
      ]
    },
    "related_words": [
      "Aristocrat",
      "Noble"
    ]
  },
  {
    "entry_id": "096da4ea-b065-45ff-9c2c-67ac37773ca9",
    "headword_english": "Arrogance",
    "pos": [
      "noun"
    ],
    "headword_sesotho": [
      {
        "orthographic": "boikakaso",
        "tone_marked": "",
        "ipa": "",
        "tone_pattern": ""
      }
    ],
    "syllables": [
      "boikakaso"
    ],
    "morphology": {
      "root": "",
      "derivation": "Historical Entry (Casalis)",
      "noun_class": "unknown"
    },
    "senses": [
      {
        "sense_id": "sense_1",
        "definition_en": "boikakaso, boikgoantšo",
        "sesotho_term": [
          "boikakaso",
          "boikgoantšo"
        ]
      },